{"catalogRevision":"w1-private-2026.08.27.1","catalogSha256":"0bd9ca38ac2e37be8b3b86affb1eebc386e7a2c7ef4ee884f54787d4429fc344","catalogUri":"registry/generated/v1/snapshots/w1-private-2026.08.27.1/index.json","expiresAt":"2027-08-28T00:00:00Z","issuedAt":"2026-08-28T00:00:00Z","revocationsSha256":"bb840dc7fcad6df498f9ef8b7c533e3d0c7047e8eeaddbb02139d165a5b93f6e","revocationsUri":"registry/generated/v1/snapshots/w1-private-2026.08.27.1/revocations.json","schemaVersion":1,"sourceBindings":[{"manifestSha256":"401a734b95aefbd8a24e1eb102f0c0c173a1491e14d8df003d22f060ac31f035","packageId":"com.mastylolabs.clock","packagePath":"packages/com.mastylolabs.clock/1.0.0","packageVersion":"1.0.0","repositoryCommitSha":"7a1faa24d291db69f2c6fb4ab2669ba0811ad83a","sourceTreeSha256":"a1c7383525aa93ba1d8de44dbe7a385a73e58a99b3ec7b8c26c9d17eef0bc363"},{"manifestSha256":"0447eaf89445a4e18074e35f1345ca5011f56eade6d44d11ed0b334de9366651","packageId":"org.catppuccin.mocha","packagePath":"packages/org.catppuccin.mocha/1.0.0","packageVersion":"1.0.0","repositoryCommitSha":"7a1faa24d291db69f2c6fb4ab2669ba0811ad83a","sourceTreeSha256":"b22d7938ccb4ddb83ba234ea1254f3575a906c990dbabd2b04a498fc049ea0f4"}]}